{
  "schema_version": 1,
  "chapter": "v01_c001",
  "generated_at": "2026-05-20T17:44:16+00:00",
  "model": "deepseek-v4-pro",
  "status": "BLOCKED",
  "action": "Revise once",
  "official_chapter": {
    "path": "chapters/v01/c001.md",
    "sha256": ""
  },
  "inputs": [],
  "summary": "migration draft; run DeepSeek anti-AI review against the current official chapter",
  "categories": {
    "show_dont_tell": {
      "status": "BLOCKED",
      "severity": "P1",
      "evidence_quotes": [],
      "issue": "migration draft; DeepSeek must inspect current official chapter",
      "revision_actions": [
        "run `python scripts/novel.py deepseek-anti-ai-review v01_c001` before Ship"
      ]
    },
    "rhythm_disorder": {
      "status": "BLOCKED",
      "severity": "P1",
      "evidence_quotes": [],
      "issue": "migration draft; DeepSeek must inspect current official chapter",
      "revision_actions": [
        "run `python scripts/novel.py deepseek-anti-ai-review v01_c001` before Ship"
      ]
    },
    "emotional_risk": {
      "status": "BLOCKED",
      "severity": "P1",
      "evidence_quotes": [],
      "issue": "migration draft; DeepSeek must inspect current official chapter",
      "revision_actions": [
        "run `python scripts/novel.py deepseek-anti-ai-review v01_c001` before Ship"
      ]
    },
    "gray_motive": {
      "status": "BLOCKED",
      "severity": "P1",
      "evidence_quotes": [],
      "issue": "migration draft; DeepSeek must inspect current official chapter",
      "revision_actions": [
        "run `python scripts/novel.py deepseek-anti-ai-review v01_c001` before Ship"
      ]
    },
    "dialogue_agenda": {
      "status": "BLOCKED",
      "severity": "P1",
      "evidence_quotes": [],
      "issue": "migration draft; DeepSeek must inspect current official chapter",
      "revision_actions": [
        "run `python scripts/novel.py deepseek-anti-ai-review v01_c001` before Ship"
      ]
    },
    "detail_economy": {
      "status": "BLOCKED",
      "severity": "P1",
      "evidence_quotes": [],
      "issue": "migration draft; DeepSeek must inspect current official chapter",
      "revision_actions": [
        "run `python scripts/novel.py deepseek-anti-ai-review v01_c001` before Ship"
      ]
    },
    "setting_integration": {
      "status": "BLOCKED",
      "severity": "P1",
      "evidence_quotes": [],
      "issue": "migration draft; DeepSeek must inspect current official chapter",
      "revision_actions": [
        "run `python scripts/novel.py deepseek-anti-ai-review v01_c001` before Ship"
      ]
    },
    "consequence_integrity": {
      "status": "BLOCKED",
      "severity": "P1",
      "evidence_quotes": [],
      "issue": "migration draft; DeepSeek must inspect current official chapter",
      "revision_actions": [
        "run `python scripts/novel.py deepseek-anti-ai-review v01_c001` before Ship"
      ]
    }
  },
  "dialogue_samples": [],
  "blockers": [
    "migration draft is not reviewed by DeepSeek"
  ],
  "warnings": [],
  "human_acceptance": null
}
